{
    "date": "2012-12-19T08:46Z",
    "description": "Text description of the contents for presentation in a confirmation dialog.",
    "generator": { 
        "program": "SuperCool.app",
        "creator": "Aptomar AS"
    },
    "manifest_version": 1,
    "asset": {
        "layers": { 
            "layer-1": {
                "name": "Layer 1 Name",
                "geometry": {
                    "type": "text/x-shapefile",
                    "data": ["layers/layer1.shp", "layers/layer1.dbf", "layers/layer1.shx"]                
                },
                "style": {
                    "data": ["file:styles/layer1.xml", "data:...", "http://"],
                    "type": "text/x-sld"
                },
                "resources": {
                    "data": ["file:resource1.png", "file:resource2.png"]
                }
            },
            "layer-2": {
                "name": "Layer 2 Name",
                "geometry": {
                    "type": "text/x-shapefile",
                    "data": ["layers/layer1.shp", "layers/layer1.dbf", "layers/layer1.shx"]                
                },
                "style": {
                    "data": ["file:styles/layer1.xml", "data:...", "http://"],
                    "type": "text/x-sld"
                },
                "resources": {
                    "data": ["file:resource1.png", "file:resource2.png"]
                }
            }
         },
        "groups": { 
            "group-1": {
                "name": "Group 1 Name",
                "layers": ["layer-1"]
            },
            "group-2": {
                "name": "Group 2 Name",
                "layers": ["layer-1"]
            }
        }
    }
}
